{
  "version": "1.0",
  "authority": "SKILL.md",
  "scope": "public-repository-knowledge-boundary",
  "policy": {
    "publicKnowledgeMustEqualAdmissionManifest": true,
    "removedSourcesCannotBeRuntimeFallbacks": true,
    "privateArchiveLocationsAreNotPublished": true,
    "historyRewriteRequiresSeparateApproval": true,
    "tagsAndReleasesRequireSeparateApproval": true
  },
  "currentBoundary": {
    "admittedManifest": "governance/knowledge-admission.json",
    "admittedFileCount": 142,
    "packageKnowledgeFileCount": 142,
    "retrievalAuthority": "knowledge-base/retrieval-scope.yaml"
  },
  "removedArtifacts": [
    {
      "id": "ztde-removed-fe825d03c27f795f",
      "previousPath": "knowledge-base/architecture/ATAM.md",
      "category": "raw-architecture-source",
      "preRemovalContentDigest": {
        "algorithm": "sha256",
        "value": "61f570c9eec9e154c56b99aaeb3e15c7ebcd5fc12ad3369baa00492df3df40d0"
      },
      "disposition": "remove-from-public-tree",
      "publicDistributionDecision": "prohibited",
      "packageDecision": "prohibited",
      "retrievalDecision": "prohibited",
      "admissionDecision": "not-admitted",
      "privateArchiveStatus": "owner-confirmed-private-backup-outside-repository",
      "maintainedReplacementPaths": [
        "knowledge-base/maintained/architecture/MASTER.md",
        "knowledge-base/maintained/architecture/component-boundaries.md",
        "knowledge-base/maintained/architecture/product-platforms.md",
        "knowledge-base/maintained/architecture/quality-attributes-and-evaluation.md"
      ],
      "ownerReviewedBy": "ZtotheZ",
      "ownerReviewedAt": "2026-08-31T00:00:00+03:00",
      "removalEvidence": {
        "currentTreeAbsent": true,
        "removalCommit": "2d77beb",
        "historicalGitObjectDecision": "separate-owner-approval-required",
        "tagAndReleaseDecision": "separate-owner-approval-required"
      }
    },
    {
      "id": "ztde-removed-a69030665cca1e2c",
      "previousPath": "knowledge-base/architecture/DOOS_2 updated.md",
      "category": "raw-architecture-source",
      "preRemovalContentDigest": {
        "algorithm": "sha256",
        "value": "74e331b7821fff5df058a0b5575a0421628ad17e6b86b2b92740e000bf98577d"
      },
      "disposition": "remove-from-public-tree",
      "publicDistributionDecision": "prohibited",
      "packageDecision": "prohibited",
      "retrievalDecision": "prohibited",
      "admissionDecision": "not-admitted",
      "privateArchiveStatus": "owner-confirmed-private-backup-outside-repository",
      "maintainedReplacementPaths": [
        "knowledge-base/maintained/architecture/MASTER.md",
        "knowledge-base/maintained/architecture/component-boundaries.md",
        "knowledge-base/maintained/architecture/product-platforms.md",
        "knowledge-base/maintained/architecture/quality-attributes-and-evaluation.md"
      ],
      "ownerReviewedBy": "ZtotheZ",
      "ownerReviewedAt": "2026-08-31T00:00:00+03:00",
      "removalEvidence": {
        "currentTreeAbsent": true,
        "removalCommit": "2d77beb",
        "historicalGitObjectDecision": "separate-owner-approval-required",
        "tagAndReleaseDecision": "separate-owner-approval-required"
      }
    },
    {
      "id": "ztde-removed-b99e8382db43960b",
      "previousPath": "knowledge-base/architecture/Evaluation.md",
      "category": "raw-architecture-source",
      "preRemovalContentDigest": {
        "algorithm": "sha256",
        "value": "62bdc55c892d7a5eb118f556541d37c06114949a658b95b405159acbc1f50769"
      },
      "disposition": "remove-from-public-tree",
      "publicDistributionDecision": "prohibited",
      "packageDecision": "prohibited",
      "retrievalDecision": "prohibited",
      "admissionDecision": "not-admitted",
      "privateArchiveStatus": "owner-confirmed-private-backup-outside-repository",
      "maintainedReplacementPaths": [
        "knowledge-base/maintained/architecture/MASTER.md",
        "knowledge-base/maintained/architecture/component-boundaries.md",
        "knowledge-base/maintained/architecture/product-platforms.md",
        "knowledge-base/maintained/architecture/quality-attributes-and-evaluation.md"
      ],
      "ownerReviewedBy": "ZtotheZ",
      "ownerReviewedAt": "2026-08-31T00:00:00+03:00",
      "removalEvidence": {
        "currentTreeAbsent": true,
        "removalCommit": "2d77beb",
        "historicalGitObjectDecision": "separate-owner-approval-required",
        "tagAndReleaseDecision": "separate-owner-approval-required"
      }
    },
    {
      "id": "ztde-removed-99736ed2c6d2ee0b",
      "previousPath": "knowledge-base/architecture/Master_Digital_Product_UIX_Architecture_Handbook.md",
      "category": "raw-architecture-source",
      "preRemovalContentDigest": {
        "algorithm": "sha256",
        "value": "7e7cd7c351804a8f072a2a4f1a318137d19b61ab8387d33ae54c48333e7761fc"
      },
      "disposition": "remove-from-public-tree",
      "publicDistributionDecision": "prohibited",
      "packageDecision": "prohibited",
      "retrievalDecision": "prohibited",
      "admissionDecision": "not-admitted",
      "privateArchiveStatus": "owner-confirmed-private-backup-outside-repository",
      "maintainedReplacementPaths": [
        "knowledge-base/maintained/architecture/MASTER.md",
        "knowledge-base/maintained/architecture/component-boundaries.md",
        "knowledge-base/maintained/architecture/product-platforms.md",
        "knowledge-base/maintained/architecture/quality-attributes-and-evaluation.md"
      ],
      "ownerReviewedBy": "ZtotheZ",
      "ownerReviewedAt": "2026-08-31T00:00:00+03:00",
      "removalEvidence": {
        "currentTreeAbsent": true,
        "removalCommit": "2d77beb",
        "historicalGitObjectDecision": "separate-owner-approval-required",
        "tagAndReleaseDecision": "separate-owner-approval-required"
      }
    },
    {
      "id": "ztde-removed-c8f7c8bc04c8ac2d",
      "previousPath": "knowledge-base/architecture/ProductPlatforms.md",
      "category": "raw-architecture-source",
      "preRemovalContentDigest": {
        "algorithm": "sha256",
        "value": "5e6c62fac934105fcf3822e50a4f7d667988abc1ba02c532410ca89dbd63059c"
      },
      "disposition": "remove-from-public-tree",
      "publicDistributionDecision": "prohibited",
      "packageDecision": "prohibited",
      "retrievalDecision": "prohibited",
      "admissionDecision": "not-admitted",
      "privateArchiveStatus": "owner-confirmed-private-backup-outside-repository",
      "maintainedReplacementPaths": [
        "knowledge-base/maintained/architecture/MASTER.md",
        "knowledge-base/maintained/architecture/component-boundaries.md",
        "knowledge-base/maintained/architecture/product-platforms.md",
        "knowledge-base/maintained/architecture/quality-attributes-and-evaluation.md"
      ],
      "ownerReviewedBy": "ZtotheZ",
      "ownerReviewedAt": "2026-08-31T00:00:00+03:00",
      "removalEvidence": {
        "currentTreeAbsent": true,
        "removalCommit": "2d77beb",
        "historicalGitObjectDecision": "separate-owner-approval-required",
        "tagAndReleaseDecision": "separate-owner-approval-required"
      }
    },
    {
      "id": "ztde-removed-3da6ba6a17054e80",
      "previousPath": "knowledge-base/architecture/SDA Components and Interfaces.md",
      "category": "raw-architecture-source",
      "preRemovalContentDigest": {
        "algorithm": "sha256",
        "value": "88b4e54c9b42776630f821e0f5e2534f83840d784854db43631d89b5b065cc80"
      },
      "disposition": "remove-from-public-tree",
      "publicDistributionDecision": "prohibited",
      "packageDecision": "prohibited",
      "retrievalDecision": "prohibited",
      "admissionDecision": "not-admitted",
      "privateArchiveStatus": "owner-confirmed-private-backup-outside-repository",
      "maintainedReplacementPaths": [
        "knowledge-base/maintained/architecture/MASTER.md",
        "knowledge-base/maintained/architecture/component-boundaries.md",
        "knowledge-base/maintained/architecture/product-platforms.md",
        "knowledge-base/maintained/architecture/quality-attributes-and-evaluation.md"
      ],
      "ownerReviewedBy": "ZtotheZ",
      "ownerReviewedAt": "2026-08-31T00:00:00+03:00",
      "removalEvidence": {
        "currentTreeAbsent": true,
        "removalCommit": "2d77beb",
        "historicalGitObjectDecision": "separate-owner-approval-required",
        "tagAndReleaseDecision": "separate-owner-approval-required"
      }
    },
    {
      "id": "ztde-removed-7b4719f384ad5652",
      "previousPath": "knowledge-base/architecture/SDA1.md",
      "category": "raw-architecture-source",
      "preRemovalContentDigest": {
        "algorithm": "sha256",
        "value": "92bf453dd510a6078b1efa5f8547752391b4d4e5e908e610b6a824f1fd7e3051"
      },
      "disposition": "remove-from-public-tree",
      "publicDistributionDecision": "prohibited",
      "packageDecision": "prohibited",
      "retrievalDecision": "prohibited",
      "admissionDecision": "not-admitted",
      "privateArchiveStatus": "owner-confirmed-private-backup-outside-repository",
      "maintainedReplacementPaths": [
        "knowledge-base/maintained/architecture/MASTER.md",
        "knowledge-base/maintained/architecture/component-boundaries.md",
        "knowledge-base/maintained/architecture/product-platforms.md",
        "knowledge-base/maintained/architecture/quality-attributes-and-evaluation.md"
      ],
      "ownerReviewedBy": "ZtotheZ",
      "ownerReviewedAt": "2026-08-31T00:00:00+03:00",
      "removalEvidence": {
        "currentTreeAbsent": true,
        "removalCommit": "2d77beb",
        "historicalGitObjectDecision": "separate-owner-approval-required",
        "tagAndReleaseDecision": "separate-owner-approval-required"
      }
    },
    {
      "id": "ztde-removed-d8f9aeeb65fa7bb9",
      "previousPath": "knowledge-base/architecture/SDA10.md",